text,pronunciation,description
Paraphrase,[PAR-uh-frayz],"To restate, put what someone else has expressed into different words.<br>The noun a paraphrase is a restatement of a text or passage to give the sense of the original in fuller terms. The verb to paraphrase means to restate something, giving the meaning in another form.<br>To quote and to paraphrase are sharply distinguished. To quote is to use or repeat the words of someone else, giving acknowledgment to the source. To paraphrase is to restate in different words what someone else has said or written.<br><br>To restate, put what someone else has expressed into different words."
Ostensible,[ah-STEN-si-bul],"Apparent, appearing or seeming to be true, professed or declared as true without being demonstrated or proved.<br>More difficult synonyms of ostensible include plausible (PLAW-zi-bul) and specious (SPEE-shus). Specious, however, has the negative suggestion of using deception to make something false appear true. A specious argument is one that looks good on the surface but is flawed underneath.<br>Ostensible is often used in opposition to real or actual. An ostensible motive is not necessarily a real motive; an ostensible advantage is not necessarily an actual advantage. Ostensible means apparent, stated as true but not necessarily proved.<br><br>Apparent, appearing or seeming to be true, professed or declared as true without being demonstrated or proved.<br>Synonyms: plausible, specious."
Digress,[di-GRES or dy-GRES],"To wander, stray from the point, ramble, deviate, go off in another direction.<br>Digress comes from the Latin digressus, which comes in turn from the prefix dis-, apart, and gradi, to go, walk, step. Digress means literally to go apart, walk away. From the same Latin source come ingress (IN-gres), the place you walk in, the entrance; and egress (EE-gres), the place you walk out, the exit.<br>Digress once was used of a physical wandering or turning aside, but that sense is now archaic (ahr-KAY-ik), which means old-fashioned. Today we do not say, ""She turned right and digressed down Main Street."" Instead, digress is used of speaking or writing that departs from the main point or subject at hand and wanders off in another direction: ""In a business report or an oral presentation, it's important to stick to the facts and not digress""; ""If she hadn't digressed so much, her lecture would have been more interesting.""<br>The corresponding noun is digression (di-GRESH-un or dy-GRESH-un):<br>""The old man's story was full of humorous digressions.""<br><br>To wander, stray from the point, ramble, deviate, go off in another direction.<br>Corresponding noun: digression.<br>Related words: ingress, the place you walk in, the entrance; egress, the place you walk out, the exit.<br>Additional useful word: archaic (ar-KAY-ik), old-fashioned."
Uncanny,[uhn-KAN-ee],"Eerie, strange, weird, mysterious: ""an uncanny experience.""<br>Uncanny may refer to something that is strange in an unnatural or unearthly way, something whose strangeness is unsettling or even frightening.<br>Uncanny may also be used to mean beyond what is normal or expected, strange in a remarkable or marvelous way, as ""an uncanny resemblance,"" or ""uncanny ability.""<br><br>Eerie, strange, weird, mysterious."
Candor,[KAN-dur],"Frankness, openness, sincere expression.<br>Synonyms include straightforwardness, outspokenness, forthrightness, and ingenuousness. Candor is the noun; the adjective is candid, frank, open, sincere.<br>The candid person expresses his or her thoughts frankly and openly, with no hesitation. The forthright person speaks directly to the point, plainly and sometimes bluntly, in a no-nonsense manner. The ingenuous (in-JEN-yoo-us) person speaks honestly and sincerely, with no hint of evasiveness or deception.<br><br>Frankness, openness, sincere expression.<br>Synonyms: straightforwardness, outspokenness, forthrightness, ingenuousness (in-JENyoo-us-nis).<br>Corresponding adjective: candid, frank, open, sincere. Synonyms of candid include forthright and ingenuous."
Morose,[muh-ROHS],"Gloomy, moody, glum, grumpy, ill-tempered, depressed. ""After weeks of futile job-hunting, he became morose.""<br>More difficult synonyms of morose include dolorous (DOH-luh-rus), which means mournful, full of sadness; lugubrious (luh-GOO-bree-us), which means extremely gloomy or dismal; and saturnine (SAT-ur-nyn), which means having a bitter disposition or sour outlook on life.<br>Antonyms—words opposite in meaning—include optimistic, jovial (JOH-vee-ul), and sanguine (SANG-gwin), which means having a cheerful, confident outlook on life.<br>Sullen (SUHL-in) and morose are close in meaning. When you refuse to speak or associate with people because you're in a bad mood, you are being sullen. When you are depressed and silent because you are feeling bitter or resentful, you are morose. Merriam-Webster's Collegiate Dictionary, tenth edition, says that morose suggests ""bitterness or misanthropy."" Misanthropy (mis-AN-thruh-pee) is hatred of humankind, a spiteful or pessimistic attitude about the human race. Moroseness is ill-tempered, bitter gloominess.<br><br>Gloomy, moody, glum, grumpy, ill-tempered, depressed.<br>Synonyms: sullen, dolorous, lugubrious, saturnine.<br>Antonyms: optimistic, jovial, sanguine.<br>Corresponding noun: moroseness.<br>Additional useful word: misanthropy, hatred of humankind."
Adept,[uh-DEPT],"Skilled.<br>Synonyms include handy, clever, able, deft, expert, adroit, dexterous (DEK-strus, also DEK-stur-us), and proficient (pruh-FISH-int, not proh-).<br>Adept comes from the Latin adeptus, an alchemist who has learned how to do the impossible—change base metals into gold. The noun an adept (AD-ept) means a highly skilled person, an expert. The adjective adept means skilled, dexterous, proficient: ""He was adept at managing his investments, and they always turned a handsome profit.""<br><br>Skilled, handy.<br>Synonyms: clever, able, deft, expert, dexterous, proficient, adroit (Level 3, Word 41).<br>Corresponding noun: adept (AD-ept), a highly skilled person, an expert."
Saturated,[SACH-uh-RAY-tid],"Soaked, thoroughly wet, full of moisture.<br>Synonyms include drenched, steeped, permeated (PUR-mee-AY-tid), impregnated, imbued (im-BYOOD), and sodden (SAHD-’n).<br>Sodden may mean heavy with moisture, soggy, or dull, stupefied, expressionless, as from drinking too much liquor. To saturate means to soak or wet thoroughly, either literally, as in ""My french fries are saturated with oil,"" or figuratively: ""The company saturated the media with ads for its new product."" Saturation is the corresponding noun.<br><br>Soaked, drenched, thoroughly wet, full of moisture.<br>Synonyms: steeped, permeated, impregnated, imbued, sodden.<br>Corresponding noun: saturation."
Pragmatic,[prag-MAT-ik],"Practical, having to do with actual practice, concerned with everyday affairs as opposed to theory or speculation.<br>Pragmatic comes from the Latin pragmaticus, which means skilled in business or law. The lawyer is concerned with evidence and proof; the businessperson is concerned with facts and figures. Both have little time for idle speculation or harebrained schemes. Both must be pragmatic, concerned with practical, everyday affairs.<br><br>Practical, having to do with actual practice, concerned with everyday affairs as opposed to theory or speculation."
Congenial,[kun-JEE-nee-ul],"Sympathetic, agreeable, compatible, kindred, harmonious, having the same taste, nature, or temperament.<br>Congenial persons have similar or sympathetic tastes, interests, or personalities. Congenial things agree, go well together.<br>Antonyms, or opposites, of congenial are alien, dissident (DIS-uh-dint), and incongruous (in-KAHNG-groo-us).<br>Sympathetic, agreeable, having the same taste, nature, or temperament.<br>Synonyms: compatible, kindred, harmonious.<br>Antonyms: alien, dissident, incongruous (in-KAHNG-groo-us)."
Capricious,[kuh-PRISH-us],"Unpredictable, tending to change abruptly for no apparent or logical reason.<br>Synonyms of capricious include flighty, changeable, impulsive, and fickle. More difficult synonyms include erratic, whimsical (W(H)IM-zi-kul), volatile (VAHL-uh-tul), and mercurial (mur-KYUR-ee-ul).<br>A caprice (kuh-PREES) is a sudden change of mind or change in the emotions. A person or a thing that is capricious is subject to caprices—to abrupt, unpredictable changes: ""He's so capricious, his mood changes with the wind""; ""New England has a capricious climate""; ""The stock market is notoriously capricious.""<br>Did you notice that my recommended pronunciation for capricious is kuh-PRISH-us, the second syllable rhyming with wish? You will hear educated speakers say kuh-PREE-shus, a pronunciation based on the corresponding noun caprice (kuh-PREES). This variant has been recognized by American dictionaries since the 1960s. But authorities have preferred kuh-PRISH-us since the 18th century, when pronunciation was first recorded. Current American dictionaries list kuh-PRISH-us first, and it is the only pronunciation in the Oxford English Dictionary. Have you ever heard anyone put an E in the middle of suspicious, judicious, or avaricious ? Rhyme capricious with delicious.<br><br>Unpredictable, tending to change abruptly for no apparent or logical reason.<br>Synonyms: flighty, changeable, impulsive, fickle, erratic, whimsical, volatile, mercurial.<br>Antonyms: stable, reliable, unwavering, steadfast, abiding.<br>Corresponding noun: caprice, a sudden change of mind or change in the emotions.<br>Pronunciation tip: caprice is pronounced kuhPREES; capricious should rhyme with delicious.<br>"
Blatant,[BLAYT-’nt],"Noisy, disagreeably or offensively loud, boisterous, clamorous: ""the blatant sound of horns honking in heavy traffic.""<br>Blatant is also used to mean sticking out in a glaring way, obtrusive, flagrant, as in ""a blatant lie,"" ""a blatant error,"" ""a blatant attempt to impress the boss.""<br>In either sense, blatant suggests something conspicuous and disagreeable.<br><br>Noisy, disagreeably or offensively loud, boisterous, clamorous; also, sticking out in a glaring way, obtrusive, flagrant."
Obligatory,[uh-BLIG-uh-tor-ee],"Required, necessary, binding, mandatory.<br>Obligatory duties are those you must perform to fulfill an obligation or responsibility. Doing miscellaneous paperwork is an obligatory function of the clerical worker.<br>Do not pronounce the initial o in obligatory like the o in open. Pronounce it like the a in above.<br><br>Required, necessary, binding, mandatory.<br>Antonyms: optional, voluntary."
Negligible,[NEG-li-ji-bul],"Unimportant, trifling, of little consequence.<br>That which is negligible can be neglected. A negligible concern can be disregarded; it is so trivial and insignificant that it warrants little or no attention.<br><br>Unimportant, trifling, of little consequence.<br>Synonyms: trivial, insignificant"
Adamant,[AD-uh-mint],"Unyielding, immovable, inflexible, refusing to give in, unshakable, unrelenting, implacable. ""She was adamant in her opposition to the plan.""<br>The adjective adamant comes from the noun adamant, which refers to a hard substance or stone, such as a diamond, that in ancient times was believed to be unbreakable. There is an old word adamantine (AD-uh-MAN -tin), still listed in current dictionaries but not often used; it means like adamant, very hard, unbreakable. The adjective adamant, which has replaced adamantine in current usage, means hard in the sense of inflexible, immovable, unyielding.<br><br>Unyielding, immovable, inflexible, refusing to give in.<br>Synonyms: unshakable, unrelenting, implacable."
Sporadic,[spuh-RAD-ik or spor-AD-ik],"Occasional, infrequent, irregular, not constant, happening from time to time, occurring in a scattered or random way.<br>A business venture may have sporadic success. A gambler's luck may be sporadic. Sporadic crimes are crimes scattered throughout a city or neighborhood. Sporadic outbreaks of a disease in the population are occasional, isolated outbreaks.<br>Antonyms of sporadic include constant, incessant (in-SES-int), and unremitting.<br><br>Occasional, infrequent, irregular, not constant, happening from time to time, occurring in scattered or random way.<br>Antonyms: constant, incessant, unremitting."
Vanguard,[VAN-gahrd],"The forefront of an action or movement, leading position or persons in a movement: ""They were in the vanguard of the war on poverty.""<br>In its strict military sense, vanguard means the troops moving at the head of an army, the part of the army that goes ahead of the main body, an advance guard.<br><br>The forefront of an action or movement, leading position or persons in a movement."
Concur,[kun-KUR],"To agree, be in accord with, unite in opinion.<br>Concur comes from the Latin con-, together, and currere, to run, flow, and means literally to run or flow together, go along with. That derivation has led to three slightly different meanings of the word.<br>First, concur may be used to mean to act together, combine in having an effect, as ""Time and chance concurred in our success.""<br>Second, concur may be used to mean happen together, occur at the same time, coincide, as ""His pay raise concurred with his promotion.""<br>The third and most common meaning of concur is to agree, as ""Your story concurs with theirs""; ""We concurred on almost every point of negotiation.""<br><br>(1)	To agree, be in accord with, unite in opinion.<br>(2)	To act together, combine in having an effect.<br>(3)	To happen together, occur at the same time, coincide.<br>Etymology tip: One meaning of the Latin prefix con- is ""together."" By derivation, that which concurs happens together, acts together, or is together in opinion."
Precociousness,[pruh-KOH-shus-nis],"Early development or maturity, especially in mental ability.<br>The noun precociousness and the adjective precocious come from the Latin praecox, which means premature, or literally, ""ripening before its time."" Precocious is most often used of children whose intellectual or emotional development is unusually advanced. Precociousness, early development, is the opposite of retardation, slowness in development.<br><br>Early development or maturity, especially in mental ability.<br>Antonym: retardation.<br>Corresponding adjective: precocious."
Aloof,[uh-LOOF],"Apart, at a distance, removed, withdrawn, not wishing to speak or associate with others.<br>The aloof person is emotionally reserved and keeps a cool distance from others. Aloofness means reluctance to get involved or take an interest in something.<br>Synonyms of aloof include unsympathetic, unapproachable, standoffish , and indifferent.<br>Apart, at a distance, removed, withdrawn, not wishing to speak or associate with others.<br>Synonyms: unsympathetic, unapproachable, standoffish, indifferent."
Creed,[rhymes with need],"Belief, professed faith or opinion, especially a system of religious belief. Synonyms include doctrine and dogma.<br>In the United States it is illegal to discriminate against someone based on race or creed, belief.<br>Creed comes from the Latin credo, ""I believe,"" the source of the English word credo (KREE-doh or, like the Latin, KRAY-doh). A credo is a declared set of beliefs or opinions.<br>Credo and creed are synonymous. Credo is the more learned (LUR-nid) word, usually reserved for a formal declaration of belief. Creed is used more generally of any professed faith or opinion.<br>The Latin credo is also the source of incredible, not believable, credible, believable, and credulous (KREJ-uh-lus). Credulous means inclined to believe, willing to accept something as true without questioning. Credulous and gullible are synonymous. To a credulous person, even the most outrageous tall tales seem credible.<br><br>Belief, professed faith or opinion, especially a system of religious belief.<br>Synonyms: doctrine, dogma, credo (KREE-doh or KRAY-doh).<br>Related words: incredible, credible, credulous. Credulous means willing to accept something as true without questioning. Credulous and gullible are synonymous."
Tawdry,"[TAW-dree, rhymes with Audrey]","Cheap and showy, gaudy, garish, sleazy.<br>Legend has it that tawdry comes from the phrase ""tawdry lace,"" a corruption of ""Saint Audrey lace,"" a type of lace sold at Saint Audrey's fair in England. Apparently the lace was of inferior quality, thus over time the word tawdry came to mean cheap and showy. Today the word may be used both literally and figuratively. A person may wear tawdry clothing or have a tawdry reputation.<br><br>Cheap and showy, gaudy, garish, sleazy.<br>Etymology: Tawdry comes from the phrase ""tawdry lace,"" a corruption of ""Saint Audrey lace,"" an inferior type of lace sold at Saint Audrey's fair in England."
Peevish,[PEE-vish],"Irritable, cross, complaining, fretful, ill-humored and impatient, difficult to please.<br>There are peevish moods, peevish remarks, and peevish looks. A peeve is something that irritates or annoys: ""Her pet peeve is a wet towel left on the bed."" Peevish means irritable, ill-humored, full of complaints.<br><br>Irritable, cross, complaining, fretful, ill-humored and impatient, difficult to please, full of complaints.<br>Corresponding noun: peeve, something that irritates or annoys. N.B. Compare cantankerous (Level 1, Word 41)."
Arduous,[AHR-joo-us],"Very difficult, hard to achieve or accomplish, requiring great effort. ""Compiling the annual report is an arduous task."" ""Raising children is an arduous responsibility.""<br>Synonyms of arduous include strenuous, laborious, and toilsome.<br><br>Very difficult, hard to achieve or accomplish, requiring great effort.<br>Synonyms: strenuous, laborious, toilsome."
Personable,[PUR-suh-nuh-buul],"Attractive, pleasing in appearance, handsome, comely, fair, presentable.<br>In recent years, personable has come to be used to mean having a nice personality. You should avoid using the word in that way. The words sociable, affable, and amiable already suggest people who are friendly, pleasant, and approachable. There is no need for personable to take over this sense. An awkward or unbecoming person, no matter how friendly and pleasant, cannot correctly be personable. Reserve personable for someone who is either attractive in appearance or attractive both in appearance and personality.<br><br>Attractive, pleasing in appearance.<br>Synonyms: handsome, comely, fair, presentable.<br>Usage tip: Avoid using personable to mean having nice personality. Sociable, affable, and amiable already suggest people who are friendly, pleasant, and approachable. An awkward or unbecoming person, no matter how friendly and pleasant, cannot correctly be personable. Reserve personable either for someone who is attractive in appearance or attractive both in appearance and personality."
Resolute,[REZ-uh-loot],"Firmly determined or settled, resolved, having a set opinion or purpose, steadfast, unwavering, persevering.<br>Resolute comes from the Latin resolvere, the source also of the verb to resolve, which means to decide, determine, settle once and for all: ""After much debate, the board of directors resolved to go ahead with the five-year plan."" ""The lawyers tried to resolve the case out of court."" Resolute means resolved in one's opinion or purpose: ""He was resolute about earning a master's degree and starting a successful business.""<br>Antonyms of resolute include irresolute, unsteady, and vacillating (VAS-i-lay-ting).<br><br>Firmly determined or settled, resolved, having a set opinion or purpose.<br>Synonyms: steadfast, unwavering, persevering.<br>Antonyms: irresolute, unsteady, vacillating.<br>Corresponding verb: resolve, to decide, determine, settle once and for all."
Supposition,[SUHP-uh-ZISH-in],"An assumption, theory, hypothesis.<br>To suppose means to assume as true, put something forward for consideration. A supposition is something supposed, an idea put forward for consideration.<br>A hypothesis (hy-PAHTH-uh-sis), a conjecture (kun-JEK-chur), and a supposition are all assumptions or theories.<br>A hypothesis is a preliminary or incomplete theory based on insufficient evidence: ""There are conflicting hypotheses about the origin of the universe."" (The plural, hypotheses, is pronounced hy-PAHTH-uh-seez.)<br>A conjecture is an assumption based on so little evidence that it is merely an educated guess: ""Every week we hear different conjectures about trends in the stock market.""<br>A supposition may be based on ample evidence or no evidence at all, and may be either sensible or irrational: ""His suppositions about the company's financial condition proved consistent with the facts.""<br><br>An assumption, theory, hypothesis, conjecture."
Arbitrary,[AHR-bi-TRAIR-ee or -TRER-ee],"Unreasoned, based on personal feelings or preferences rather than on reason, logic, or law: ""An arbitrary price for a product is not necessarily a fair price""; ""His arbitrary decisions have cost the company a lot of money.""<br>Arbitrary comes from the same Latin source as the words arbiter (AHR-bi-tur) and arbitrator (AHR-bi-TRAY-tur). Arbiter and arbitrator both mean a judge or umpire who makes a final decision or resolves a dispute. Arbitrary means making discretionary judgments or decisions that may or may not be fair or reasonable.<br>Arbitrary has two other useful meanings. It may mean determined or arrived at in a random or illogical manner. For example, the arrangement of furniture in a room may be arbitrary, without an evident theme or pattern; arbitrary decisions are arrived at in a hasty, haphazard way. Arbitrary may also mean exercising unrestrained or absolute power: an arbitrary government has no regard for individual liberty.<br><br>(1)	Unreasoned; based on personal feelings or preferences rather than on reason, logic, or law; making discretionary judgments or decisions that may or may not be fair or reasonable.<br>(2)	Determined or arrived at in a random or illogical manner.<br>(3)	Exercising unrestrained or absolute power.<br>Related words: Arbiter and arbitrator both mean a judge or umpire who makes a final decision or resolves a dispute."
Monotonous,[muh-NAHT-uh-nus],"Lacking variety, tediously uniform, unvarying and dull.<br>Monotonous means literally having one continuous sound or tone. It combines the word tone with the prefix mono-, one, single. The prefix mono- appears in many English words, including monogamy (muh-NAHG-uh-mee), marriage to one person; monocle (MAHN-uh-kul), a single eyeglass; and monogram (MAHN-uh-gram), two or more letters woven into one.<br>That which is monotonous is boring because it lacks variety. A monotonous speaker says the same thing again and again in the same tone of voice. Monotonous music is dull and repetitive. A monotonous job is one where the routine never changes. The corresponding noun is monotony (muh-NAHT’n-ee), a tedious lack of variety.<br><br>Lacking variety, tediously uniform, unvarying and dull; literally, having one continuous sound or tone.<br>Etymology tip: The prefix mono- means ""one, single,"" as in the related words monogamy, monocle, and monogram."
Legacy,[LEG-uh-see],"Something handed down from the past, an inheritance.<br>Legacy may be used in two ways. It may mean a gift of money or property provided by a will, an inheritance, bequest: ""Her wealthy uncle left her a generous legacy."" It may also mean anything inherited or passed down through time: ""The cultural legacy of ancient Greece and Rome has shaped Western civilization.""<br>Something handed down from the past.<br>Synonyms: inheritance, bequest."
Manifold,[MAN-i-fohld],"Numerous and varied, consisting of many kinds, containing many elements, features, or characteristics: a large company with manifold operations and divisions; a challenging executive position with manifold responsibilities.<br>Manifold may sound like a fancy substitute for many, but it's not. While many simply means much, a lot, manifold emphasizes variety, diversity. If your job has manifold duties then the things you do are both numerous and varied.<br>Equally difficult synonyms of manifold are multifarious (MUHL-ti-FAIR -ee-us) and multitudinous (MUHL-ti-T(Y)OO-di-nus). Both manifold and multifarious mean having great variety or diversity: The human race is multifarious, and human nature is even more complex and manifold.<br>Multitudinous means containing a multitude, consisting of a great number of persons or things: ""After his promotion to management, Bob was sometimes overwhelmed by mountains of paperwork and multitudinous administrative chores.""<br><br>Numerous and varied, consisting of many kinds, containing many elements, features, or characteristics.<br>Synonyms: multifarious, multitudinous."
Pliant,[PLY-int],"Bending easily, flexible, adaptable, workable.<br>Pliant comes from the French plier, to bend, the same source as pliers, the tool commonly used for bending or manipulating wires or metal pieces.<br>Pliant, pliable, and supple all mean bending or moving easily. Pliant and pliable usually refer to objects that are easily workable. Supple may apply to material things or to a human body that is flexible and limber.<br><br>Bending easily, flexible.<br>Synonyms: adaptable, workable, pliable, supple."
