text,pronunciation,description
Intransigent,[in-TRAN-si-jent],"Uncompromising, refusing to come to an agreement, unwilling to modify one's position or give ground.<br>Synonyms of intransigent include irreconcilable, unyielding, diehard, hidebound, obstinate (word 34 of Level 1), resolute (REZ-uh-loot), tenacious (te-NAY-shus), recalcitrant (ri-KAL-suh-trint), intractable (in-TRAK-tuh-buul), refractory (word 42 of Level 6), and obdurate (AHB-d(y)uu-rit).<br>Antonyms include compromising, flexible, obliging, submissive, compliant, malleable (word 29 of Level 2), docile (word 28 of Level 7), tractable, deferential, acquiescent (AK-wee-ES-int), and complaisant (kum-PLAY-zint).<br>Intransigent combines the privative prefix in-, meaning ""not,"" with the Latin verb transigere, to come to a settlement, and means literally refusing to settle, unwilling to come to an agreement, uncompromising.<br>Resolute, tenacious, obstinate, intractable, refractory, obdurate, and intransigent suggest firmness or fixity in ascending intensity. The resolute person is firmly settled in opinion, resolved to pursue a course of action. Tenacious, which comes from the Latin tenere, to hold, suggests holding firmly; the tenacious person adheres persistently and sometimes doggedly to a belief or course of action. Obstinate implies stubborn adherence to an opinion or purpose and strong resistance to contrary influence or persuasion. Intractable means hard to lead or manage; the intractable person stubbornly resists direction. Refractory means stubborn and disobedient; a refractory person actively resists authority or control.<br>Obdurate means stubbornly hardhearted; the obdurate person cannot be moved by appeals to the emotions.<br>Our keyword, intransigent, combines the firmness of resolute, the persistence of tenacious, the stubborn resistance of obstinate, intractable, and refractory, and the hardheartedness of obdurate. The intransigent person takes an extreme position and will not compromise or back down under any circumstances.<br><br>Uncompromising, refusing to come to an agreement, unwilling to modify one's position or give ground.<br>Synonyms: unreconcilable, unyielding, diehard, hidebound, obstinate (Level 1, Word 34), resolute (Level 1, Word 26), tenacious, recalcitrant, intractable, refractory (Level 6, Word 42), obdurate.<br>Antonyms: compromising, flexible, obliging, submissive, compliant, malleable (Level<br>2, Word 29), docile (Level 7, Word 28), tractable, deferential, acquiescent, complaisant (kumPLAY-zint).<br>Etymology: Intransigent combines the privative prefix in-, meaning ""not,"" with the Latin verb transigere, to come to a settlement, and means literally refusing to settle, unwilling to come to an agreement, uncompromising.<br>N.B. This discussion distinguishes the words resolute, tenacious, obstinate, intractable, refractory, obdurate, and intransigent, which suggest firmness or fixity in ascending intensity."
Mordant,[MOR-dint or MORD-’nt],"Biting, cutting, keen, sarcastic, scathing.<br>Additional synonyms of mordant include incisive (in-SY-siv), caustic (KAW-stik), trenchant (TRENCH-int), virulent (VIR-(y)uh-lint), and acrimonious (AK-ri-MOH-nee-us).<br>When you think of mordant, think of gnashing teeth. Mordant comes from Old French and Latin words meaning to bite, cut into, nip, or sting. Today mordant is chiefly used of speech or writing that is biting or cutting in a bitterly sarcastic way. We speak of mordant satire, mordant wit, mordant criticism, or a mordant cross-examination.<br><br>Biting, cutting, keen, sarcastic, scathing.<br>Additional synonyms: incisive, caustic, trenchant, virulent, acrimonious.<br>Mnemonic device, etymology, and usage: When you think of mordant, think of gnashing teeth. Mordant comes from Old French and Latin words meaning to bite, cut into, nip, or sting. Today mordant is chiefly used of speech or writing that is biting or cutting in a bitterly sarcastic way (mordant satire, mordant wit, mordant criticism)."
Sagacious,[suh-GAY-shus],"Wise, shrewd, perceptive; showing sound judgment and keen insight, especially in practical matters.<br>Synonyms of sagacious include insightful, discerning, astute (word 3 of Level 4), judicious (word 16 of Level 5), percipient (pur-SIP-ee-int), sage (rhymes with page), sapient (SAY-pee-int), and perspicacious (PUR-spiKAY-shus).<br>Antonyms of sagacious include undiscriminating, undiscerning, simpleminded, witless, inane (i-NAYN), gullible, credulous (KREJ-uh-lus),  obtuse (uhb-T(Y)OOS), and addlepated (AD-’l-PAY-tid).<br>The corresponding noun is sagacity, wisdom, shrewdness, keen insight or discernment.<br>Sagacious comes from the Latin sagax, having keen senses, especially a keen sense of smell. In its early days in the language, sagacious was used of hunting dogs to mean quick in picking up a scent. That sense is long obsolete. By 1755, when Samuel Johnson published his famous dictionary, sagacious had come to mean, as Johnson puts it, ""quick of thought; acute in making discoveries."" To illustrate the expanded sense,<br>Johnson quotes the philosopher John Locke: ""Only sagacious heads light on these observations, and reduce them into general propositions."" Over the years since then, sagacious continued to acquire dignity, perhaps by association with the adjective sage, which means having or showing great wisdom. Today, says the third edition of The American Heritage Dictionary (1992), sagacious ""connotes prudence, circumspection, discernment, and farsightedness.""<br>That's a far cry from the hunting hounds of yore. Yet, as those words reveal, a faint odor of quick-sniffing canine instinct still clings to the word. In current usage, the sagacious person is no brooding scholar or musing philosopher but a shrewd, sharp-eyed, keen-witted person who displays instinctive wisdom, swift insight, and sound judgment regarding mundane or practical matters. Thus we do not speak of a sagacious treatise on the meaning of life, but rather of a sagacious comment on human nature, a shrewd lawyer who asks sagacious questions, or a business executive known for making sagacious decisions—in other words, wise and keenly perceptive decisions.<br><br>Wise, shrewd, perceptive; showing sound judgment and keen insight, especially in practical matters.<br>Synonyms: insightful, discerning, astute (Level 4, Word 3), judicious (Level 5, Word 16), percipient, sage, sapient, perspicacious.<br>Antonyms: undiscriminating, undiscerning, simpleminded, witless, inane, gullible, credulous, obtuse, addlepated.<br>Corresponding noun: sagacity, wisdom, shrewdness, keen insight or discernment.<br>Etymology: Latin sagax, having keen senses, especially a keen sense of smell.<br>Sagacious originally was used of hunting dogs to mean quick in picking up a scent."
Acerbic,[uh-SUR-bik],"Sour, bitter, and harsh in flavor, tone, or character.<br>Synonyms of acerbic include tart, caustic (KAW-stik), pungent (PUHN-jint), astringent (uh-STRIN-jint), acrid (AK-rid), and acidulous (uh-SIJ-(y)uh-lus).<br>The direct antonym of acerbic is sweet.<br>Acerbic comes from a Latin word meaning sour or bitter like unripe fruit. Acerbic may be used literally to mean sour or bitter tasting, as the lemon is an acerbic fruit. However, the word acidic probably is more often used in this literal sense, and acerbic usually is used figuratively to mean sour, bitter, and harsh in tone or character: An acerbic mood is a sour mood; acerbic words are bitter words; and someone who is acerbic has a harsh, unpleasant personality.<br><br>Sour, bitter, and harsh in flavor, tone, or character.<br>Synonyms: tart, caustic, pungent, astringent, acrid, acidulous.<br>Direct antonym: sweet.<br>Usage: Acerbic may be used literally to mean sour or bitter tasting (the lemon is an acerbic fruit). However, the word acidic probably is more often used in this literal sense, and acerbic usually is used figuratively to mean sour, bitter, and harsh in tone or character (an acerbic mood, acerbic words, are bitter words; an acerbic person)."
Variegated,[VAIR-ee-uh-GAY-tid],"In a broad sense, varied, diverse, showing variety of character or form; in a strict sense, spotted, streaked, or dappled; having marks or patches of different colors, as a variegated quilt, a variegated cat, or a variegated design.<br>The verb to variegate is now often used figuratively to mean to give variety to, diversify. The adjective variegated is also frequently used in this way to mean varied, diverse, or multifaceted, as variegated interests, a variegated selection, or variegated accomplishments.<br><br>In a broad sense, varied, diverse, showing variety of character or form; in a strict sense, spotted, streaked, or dappled; having marks or patches of different colors (a variegated quilt, variegated cat, variegated design).<br>N.B. The corresponding verb to variegate is now often used figuratively to mean to give variety to, diversify. The adjective variegated is, also frequently used in this way to mean varied, diverse, or multifaceted (variegated interests, a variegated selection, variegated accomplishments)."
Succor,"[SUHK-ur, like sucker]","To aid, help, relieve, give assistance to in time of need or difficulty, as to succor the wounded or succor the sick.<br>The noun succor means help, aid, relief, assistance in time of need or distress, as to give succor to the homeless on Thanksgiving.<br>Both the verb and the noun come from a Latin verb meaning ""to run to the aid of."" Although succor and the slang verb sucker have the same pronunciation, they are not related and are virtually opposite in meaning.<br><br>To aid, help, relieve, give assistance to in time of need or difficulty (to succor the wounded, succor the sick).<br>Corresponding noun: succor, help, aid, relief, assistance in time of need or distress (to give succor to the homeless).<br>N.B. Succor and sucker have the same pronunciation but are otherwise unrelated."
Importune,[IM-por-T(Y)OON],"To trouble or annoy with requests or demands, make urgent or persistent entreaties or solicitations.<br>To remember the meaning of the verb importune, think of some annoying person who interrupts your life at an inappropriate moment and urgently asks you to do something you don't want to do. Salespeople importune you on the telephone when you're not interested and have better things to do. Panhandlers importune you on the street to beg for a handout. Children are experts at importuning parents when they are preoccupied with work or some pressing domestic chore, like cooking or paying bills.<br>The corresponding adjective is importunate (im-POR-chuh-nit), troublesomely demanding, persistent in a vexatious way.<br>To trouble or annoy with requests or demands, make urgent or persistent entreaties or solicitations.<br>Corresponding adjective: importunate (im-POR-chuu-nit), troublesomely demanding, persistent in a vexatious way."
Palliate,[PAL-ee-AYT],"To lessen the severity of, gloss over, make something seem less serious or severe, as to palliate suffering, to palliate an offense, or to palliate your troubles with drink.<br>Synonyms of palliate include soften, diminish, mitigate, and extenuate. Antonyms include worsen, intensify, aggravate, and exacerbate (ig-ZAS -ur-BAYT). Exacerbate and acerbic, keyword 7 in this level, come from the same Latin root, and both suggest bitterness or harshness. The adjective acerbic means sour, bitter, or harsh in flavor, tone, or character. The verb exacerbate means to increase in bitterness or severity, as to exacerbate a problem or exacerbate a conflict.<br>The verb to palliate comes through the Latin verb palliare, to cloak or conceal, from the noun pallium, a cloak. Palliate was once used to mean to cover as if with a cloak, to shelter, hide, conceal. This meaning is now obsolete, and today palliate means to conceal or cloak the seriousness of something, make it appear less severe or offensive than it is, as to palliate a social indiscretion or palliate the enormity of a crime.<br>In modern usage, palliate often connotes glossing over or disguising the seriousness of something by making excuses or apologies: ""Her press agent issued a statement in an attempt to palliate her role in the scandal.""<br><br>To lessen the severity of, gloss over, make something seem less serious or severe.<br>Synonyms: soften, diminish, mitigate, extenuate,<br>Antonyms: worsen, intensify, aggravate, exacerbate. Exacerbate means to increase in bitterness or severity (to exacerbate a problem, exacerbate a conflict). Etymology: Latin palliare, to cloak or conceal, from pallium, a cloak.<br>Usage: Palliate means to conceal or cloak the seriousness of something, make it appear less severe or offensive than it is (to palliate suffering, palliate a social indiscretion, palliate the enormity of a crime). Palliate often connotes glossing over or disguising the seriousness of something by making excuses or apologies."
Wizened,[WIZ-’nd],"Dried up, shriveled, withered, shrunken and wrinkled.<br>The verbs to wither, to shrivel, and to wizen all imply drying up. Webster's New World Dictionary, second college edition (1988), explains that wither suggests a loss of natural juices: ""The grapes were left to wither on the vine."" Shrivel suggests shrinking and curling as from exposure to intense heat: ""With a heavy sigh, Scott removed the shriveled steak from the barbecue."" Wizen (WIZ-’n) suggests shrinking and wrinkling from advanced age or malnutrition.<br>Although the verb to wizen now is somewhat rare, its past participle, wizened, is still often used of persons or parts of the body to mean shrunken and wrinkled, dried up by age or disease: An old person's face may be wizened, or someone's body may be wizened by cancer.<br>Here is a passage from my vocabulary-building mystery novel, Tooth and Nail, in which the context attempts to illustrate the meaning of wizened: ""An ancient, wizened man shuffled into the room, supporting his stooped and shriveled frame with a stout oaken staff…His face was sallow and deeply wrinkled; his cheeks were sunken and his crown was entirely bald. But for his eyes, which twinkled roguishly, he was a picture of death.""<br><br>Dried up, shriveled, withered, shrunken and wrinkled.<br>N.B. This discussion distinguishes the verbs to wither, shrivel, and wizen, which imply drying up.<br>Usage: The verb to wizen now is somewhat rare, but its past participle, wizened, is still often used of persons or parts of the body to mean shrunken and wrinkled, dried up by age or disease (a wizened face, a wizened body, a wizened man)."
Captious,[KAP-shus],"Faultfinding, quick to point out faults or raise trivial objections.<br>Synonyms of captious include carping, quibbling, caviling, censorious (sen-SOR-ee-us), and querulous (KWER-uh-lus).<br>Critical, carping, and captious all mean ""inclined to look for and point out faults and defects,"" says Webster's Ninth New Collegiate Dictionary (1993).<br>Critical, though often used in a negative sense, is in fact a neutral word: the critical person tries to judge something fairly and objectively by weighing its merits and faults. Strictly speaking, a critical assessment is a fair, impartial assessment, and a critical examination may result in a supportive conclusion. Critical is so often used of harsh or unfavorable judgment, however, that the neutral sense of the word has nearly been lost; it would be nice if we took pains to preserve it.<br>Carping, says Webster's Ninth, ""implies an ill-natured or perverse picking of flaws."" Captious, which comes from the Latin captus, the past participle of the verb capere, to take or seize, ""suggests a readiness to detect trivial faults or raise objections on trivial grounds.""<br>Here's an idea: The next time you find yourself about to use critical in a negative sense, how about giving carping or captious a try instead?<br><br>Faultfinding, quick to point out faults or raise trivial objections.<br>Synonyms: carping, quibbling, caviling, censorious, querulous. This discussion distinguishes the adjectives critical, carping, and captious.<br>N.B. Critical, though often used in a negative sense, is in fact a neutral word: The critical person tries to judge something fairly and objectively by weighing its merits and faults; a critical assessment is a fair, impartial assessment, and a critical examination may result in a supportive conclusion."
Emendation,[EE-men-DAY-shin],"A correction, alteration, change made to correct or improve, especially a change made in a piece of writing to correct an error or restore the text to its original state.<br>The verb to emend (ee-MEND) means to make corrections in a text. Emendation may mean the act of emending, correcting and improving a piece of writing, or it may mean a correction made in a text.<br><br>A correction, alteration, change made to correct or improve, especially a change made in a piece of writing to correct an error or restore the text to its original state.<br>Corresponding verb: emend, to make scholarly corrections to a text.<br>N.B. Emendation may also mean the act of emending, correcting and improving a piece of writing."
Truculent,[TRUHK-yuh-lint],"Fierce, ferocious, especially in a brutal, bullying, threatening, or aggressively defiant way.<br>The corresponding noun is truculence (TRUHK-yuh-lints), fierceness, ferocity, brutal aggression.<br>Synonyms of truculent include pugnacious (puhg-NAY-shus), belligerent , malevolent (muh-LEV-uh-lint), rapacious (ruh-PAY-shus), and feral (FEER-ul).<br>Antonyms include humane, merciful, compassionate, benevolent (buh-NEV-uh-lint), and clement (KLEM-int), all of which suggest mercy or mildness, and also timid, demure (di-MYOOR), diffident (DIF-uh-dint), apprehensive, and timorous (TIM-ur-us), all of which suggest shyness or fear.<br>Truculent descends from Latin words meaning savage, fierce, cruel, or grim. In current usage truculent applies to fierce, savage, or ferocious people or to behavior that is brutal, threatening, bullying, or aggressively defiant: A truculent nation is a hostile, belligerent nation. A truculent look is a pugnacious or threatening look. A truculent philosophy of business is a brutal, aggressive, rapacious, winner-takes-all philosophy of business. In his Dictionary of Contemporary American Usage (1957), Bergen Evans offers this sentence to illustrate the meaning of truculent: ""One of my superiors was a truculent fellow who would have loved being a storm trooper under Hitler.""<br>Truculent is now also used of speech or writing to mean scathing, vicious, or vitriolic (VI-tree-AHL-ik), as a truculent retort, a truculent editorial, or a truculent political advertisement.<br><br>Fierce, ferocious, especially in a brutal, bullying, threatening, or aggressively defiant way.<br>Corresponding noun: truculence, fierceness, ferocity, brutal aggression.<br>Synonyms: pugnacious, belligerent, malevolent, rapacious, feral (FEER-ul).<br>Antonyms: humane, merciful, compassionate, benevolent, clement, which suggest mercy or mildness, and also timid, demure, diffident, apprehensive, and timorous, which suggest shyness or fear.<br>Usage: Truculent applies to fierce, savage, or ferocious people or to behavior that is brutal, threatening, bullying, or aggressively defiant. Truculent is now also used of speech or writing to mean scathing, vicious, or vitriolic."
Expurgate,[EKS-pur-GAYT],"To cleanse by removing offensive material, free from objectionable content.<br>Synonyms of expurgate include censor, purge, and bowdlerize.<br>The verbs to expurgate and bowdlerize are close in meaning. ( Bowdlerize may be pronounced BOWD-luh-ryz, first syllable rhyming with loud, or BOHD-luh-ryz, first syllable rhyming with towed. Historically the weight of authority favors BOWD-luh-ryz, which I recommend.)<br>Thomas Bowdler (BOWD-lur) was an English editor who in the early 1800s published expurgated, or cleansed, editions of the Bible and Shakepeare's works. People did not appreciate Bowdler's expurgation of the Good Book and the bawdy Bard, so they took his name and made a nasty word: bowdlerize. To bowdlerize is to remove material considered risqué, offensive, or obscene, but it connotes doing so out of a prudish or squeamish sense of morality.<br>Expurgate comes from the Latin expurgare, to cleanse, purify, and by derivation is related to the verb to purge, to free from impurities, and the adjective pure. To expurgate means to cleanse by removing that which is objectionable.<br>When something is bowdlerized, that which is considered morally offensive has been deleted. When something is expurgated, that which is considered objectionable for any reason has been deleted. You can bowdlerize Shakespeare by taking out the ribald humor, and you can bowdlerize D. H. Lawrence's novel Lady Chatterley's Lover by removing the passages about sex; but you cannot bowdlerize a textbook because presumably it does not contain anything ribald, erotic, or obscene. However, if people charge that a textbook displays a bias or draws conclusions that they find objectionable, they may attempt to expurgate it, cleanse it by removing the offensive material.<br><br>To cleanse by removing offensive material, free from objectionable content.<br>Synonyms: censor, purge, bowdlerize.<br>N.B. Bowdlerize comes from Thomas Bowdler, an English editor who in the early 1800s published expurgated, or cleansed, editions of the Bible and Shakespeare's works.<br>Etymology and related words: Expurgate comes from the Latin expurgare, to cleanse, purify, and by derivation is related to the verb to purge, to free from impurities, and the adjective pure.<br>"
Reprobate,[REP-ruh-BAYT],"Thoroughly bad, wicked, corrupt, morally abandoned, lacking all sense of decency and duty.<br>Synonyms of reprobate include unprincipled, shameless, base, vile, degenerate, depraved, irredeemable, and incorrigible. Antonyms include virtuous, pure, righteous, honorable, chaste, unsullied, and exemplary.<br>Reprobate comes from the Latin reprobare, to reprove, disapprove of strongly. In theology, the adjective reprobate means damned, predestined for damnation, and the noun a reprobate means a person rejected by God and excluded from salvation.<br>In general usage, the noun a reprobate means a corrupt, unprincipled person, a scoundrel, and the adjective reprobate means morally abandoned, bad-to-the-core, lacking all sense of decency and duty.<br><br>Thoroughly bad, wicked, corrupt, morally abandoned, lacking all sense of decency and duty.<br>Synonyms: unprincipled, shameless, base, vile, degenerate, depraved, irredeemable, incorrigible.<br>Antonyms: virtuous, pure, righteous, honorable, chaste, unsullied, exemplary.<br>Etymology: Latin reprobate, to reprove, disapprove of strongly.<br>Usage: In theology, the adjective reprobate means damned, predestined for damnation; the noun reprobate means a person rejected by God and excluded from salvation.  In general usage, the noun reprobate means a corrupt, unprincipled person, a scoundrel; the adjective reprobate means morally abandoned, bad-to-the-core, lacking all sense of decency and duty."
Spurious,[SPYUUR-ee-us],"False, counterfeit, artificial; not true, authentic, or genuine.<br>Synonyms of spurious include sham, bogus, phony, fictitious, fabricated , fraudulent, illusory (i-LOO-suh-ree), apocryphal (uh-PAHK-ri-ful), and supposititious (suh-PAHZ-i-TISH-us). Antonyms include genuine (there is no wine in genuine; say JEN-yoo-in), authentic, valid, and bona fide (BOH-nuh FYD).<br>Spurious by derivation means ""false, illegitimate."" Spurious was once used to mean of illegitimate birth, bastard, and although dictionaries still list this sense, it is now rare. Since it came into the language about 1600, and most often today, spurious is used to mean false, counterfeit, not authentic or genuine.<br>Spurious applies to that which is not what it claims or is claimed to be. A spurious document is not authentic or original, and may have been forged; spurious gems are counterfeit, not real or genuine; spurious statements are fabricated, made up; spurious feelings are affected or artificial; and a spurious charge is false, trumped-up, and should be repudiated. <br>False, counterfeit, artificial; not true, authentic, or genuine.<br>Synonyms: sham, bogus, phony, fictitious, fabricated, fraudulent, illusory, apocryphal (Level 9, Word 2), supposititious.<br>Antonyms: genuine, authentic, valid, bona fide.<br>Usage: Spurious applies to that which is not what it claims or is claimed to be (a spurious document, spurious gems, spurious statements, spurious feelings, a spurious charge)."
Volition,[voh-LISH-un],"Will, choice, decision, determination.<br>In Latin, the verb velle means to will or wish, and the word volo means ""I will."" From these words comes the English noun volition, which may refer either to the power of using the will or the act of exercising it in making a conscious choice or decision.<br>""He seems to lack volition"" implies that he is weak and unable to make a choice or determination. ""She came of her own volition"" implies that she exercised her will independently, decided on her own to come.<br><br>Will, choice, decision, determination.<br>Etymology and usage: In Latin, velle means to will or wish, and volo means ""I will."" From these words comes the English noun volition, which may refer either to the power of using the will or the act of exercising it in making a conscious choice or decision."
